pal_index,pal_name,pal_description,is_boss,is_tower_boss,element_1,element_2,item_drop_1,item_drop_2,partner_skill_title,partner_skill_description,work_suitability,stats_hp,stats_melee_attack,stats_shot_attack,stats_defense,stats_support,stats_stamina,stats_walk_speed,stats_run_speed,stats_ride_sprint_speed,stats_food_amount,stats_rarity,stats_price,male_probability,combi_rank,active_skills
-2,PAL Genetic Research Unit Commander Victor & Shadowbeak,Missing...,True,True,Dark,,,,Can be ridden as an flying mount. Enhances Dark attacks while mounted.,Can be ridden as an flying mount. Enhances Dark attacks while mounted.,Collection(Lv.1),8000,130,200,220,90,100,80,850,1100,8,10,9060,100,9999,Divine Disaster (Lv.1 | Pwr.160 | CD.45s) | Dark Whisp (Lv.2 | Pwr.160 | CD.45s) | Spirit Flame (Lv.3 | Pwr.75 | CD.16s) | Nightmare Ball (Lv.4 | Pwr.100 | CD.30s) | Blizzard Spike (Lv.5 | Pwr.130 | CD.45s) | Iceberg (Lv.6 | Pwr.70 | CD.15s) | Dark Laser (Lv.7 | Pwr.150 | CD.55s) | Cryst Breath (Lv.8 | Pwr.90 | CD.22s) | Pal Blast (Lv.9 | Pwr.150 | CD.55s) | Ice Missile (Lv.10 | Pwr.30 | CD.3s) | Icicle Cutter (Lv.11 | Pwr.55 | CD.10s)
-2,Rayne Syndicate Officer Zoe & Grizzbolt,Missing...,True,True,Electric,,,,Can be ridden. Can rapidly fire a minigun while mounted.,Can be ridden. Can rapidly fire a minigun while mounted.,"Generate Electricity(Lv.3), Handcraft(Lv.2), Deforest(Lv.2), Transport(Lv.3)",6000,100,100,100,100,100,140,470,650,6,8,6610,0,9999,Lightning Claw (Lv.1 | Pwr.90 | CD.22s) | Spark Blast (Lv.2 | Pwr.30 | CD.2s) | Shockwave (Lv.3 | Pwr.40 | CD.4s) | Electric Ball (Lv.4 | Pwr.50 | CD.9s) | Plasma Tornado (Lv.5 | Pwr.65 | CD.13s) | Lightning Streak (Lv.6 | Pwr.75 | CD.16s) | Lock-on Laser (Lv.7 | Pwr.70 | CD.15s)
-2,PIDF Officer Marcus & Faleris,Missing...,True,True,Fire,,,,"Can be ridden as an flying mount. While fighting together, Ice Pals drop more items when defeated.","Can be ridden as an flying mount. While fighting together, Ice Pals drop more items when defeated.","Emit Flame(Lv.3), Transport(Lv.3)",6500,100,120,125,90,100,200,1000,1300,8,9,6720,100,9999,Phoenix Flare (Lv.1 | Pwr.135 | CD.28s) | Flare Arrow (Lv.2 | Pwr.55 | CD.10s) | Rock Lance (Lv.3 | Pwr.150 | CD.55s) | Ignis Breath (Lv.4 | Pwr.70 | CD.15s) | Tri-Lightning (Lv.5 | Pwr.90 | CD.22s) | Ignis Rage (Lv.6 | Pwr.120 | CD.40s) | Fire Ball (Lv.7 | Pwr.150 | CD.55s) | Lightning Strike (Lv.8 | Pwr.120 | CD.40s) | Lightning Bolt (Lv.9 | Pwr.150 | CD.55s) | Spirit Fire (Lv.10 | Pwr.45 | CD.7s) | Ignis Blast (Lv.11 | Pwr.30 | CD.2s)
-2,Free Pal Alliance Founder Lily & Lyleen,Missing...,True,True,Grass,,,,"When activated, the queen's soothing graces greatly restore the player's HP.","When activated, the queen's soothing graces greatly restore the player's HP.","Seeding(Lv.3), Handcraft(Lv.2), Collection(Lv.2), Product Medicine(Lv.3)",5500,100,110,105,100,100,100,450,650,6,9,6510,0,9999,Poison Fog (Lv.1 | Pwr.0 | CD.30s) | Bubble Blast (Lv.2 | Pwr.65 | CD.13s) | Seed Mine (Lv.3 | Pwr.65 | CD.13s) | Aqua Burst (Lv.4 | Pwr.100 | CD.30s) | Multicutter (Lv.5 | Pwr.60 | CD.12s) | Grass Tornado (Lv.6 | Pwr.80 | CD.18s) | Spine Vine (Lv.7 | Pwr.95 | CD.25s)
-2,Brothers of the Eternal Pyre Soul Reader Axel & Orserk,Missing...,True,True,Dragon,Electric,,,"While fighting together, Water Pals drop more items when defeated.","While fighting together, Water Pals drop more items when defeated.","Generate Electricity(Lv.3), Handcraft(Lv.2), Transport(Lv.3)",6500,100,140,110,100,100,185,900,1300,7,9,8320,100,9999,Kerauno (Lv.1 | Pwr.100 | CD.30s) | Lightning Strike (Lv.2 | Pwr.120 | CD.40s) | Dragon Burst (Lv.3 | Pwr.55 | CD.10s) | Draconic Breath (Lv.4 | Pwr.70 | CD.15s) | Lightning Streak (Lv.5 | Pwr.75 | CD.16s) | Dragon Cannon (Lv.6 | Pwr.30 | CD.2s) | Lightning Bolt (Lv.7 | Pwr.150 | CD.55s) | Acid Rain (Lv.8 | Pwr.80 | CD.18s) | Dragon Meteor (Lv.9 | Pwr.150 | CD.55s)
-1,en_Text en_text,Missing...,True,False,Neutral,,,,Tentative text,Missing...,,100,100,100,100,100,100,-1,-1,-1,5,0,3660,50,0,
-1,Pal on the Prowl Lovander,Missing...,True,False,Neutral,,"{'drop_rate': 100, 'min_drop': 2, 'max_drop': 4, 'item_name': 'PalCrystal_Ex'}","{'drop_rate': 100, 'min_drop': 2, 'max_drop': 4, 'item_name': 'Mushroom'}","While fighting together, grants the player and Lovander the life steal effect which absorbs some of the received damage and restores HP.","While fighting together, grants the player and Lovander the life steal effect which absorbs some of the received damage and restores HP.","Handcraft(Lv.2), Mining(Lv.1), Product Medicine(Lv.2), Transport(Lv.2)",120,70,70,70,140,100,170,750,850,5,5,2450,30,940,Power Shot (Lv.1 | Pwr.35 | CD.4s) | Poison Blast (Lv.7 | Pwr.30 | CD.2s) | Shadow Burst (Lv.15 | Pwr.55 | CD.10s) | Acid Rain (Lv.22 | Pwr.80 | CD.18s) | Power Bomb (Lv.30 | Pwr.70 | CD.15s) | Implode (Lv.40 | Pwr.180 | CD.55s) | Pal Blast (Lv.50 | Pwr.150 | CD.55s)
-1,Heart-melting Smile Ribbuny,Missing...,True,False,Neutral,,"{'drop_rate': 100, 'min_drop': 1, 'max_drop': 2, 'item_name': 'PalCrystal_Ex'}","{'drop_rate': 100, 'min_drop': 1, 'max_drop': 1, 'item_name': 'Leather'}","While in team, increases attack power of Neutral Pals. While at a base, increases work efficiency if working at Weapon Workbench.","While in team, increases attack power of Neutral Pals. While at a base, increases work efficiency if working at Weapon Workbench.","Handcraft(Lv.1), Collection(Lv.1), Transport(Lv.1)",75,100,65,70,100,100,100,245,350,2,1,1160,50,1310,Air Cannon (Lv.1 | Pwr.25 | CD.2s) | Power Shot (Lv.7 | Pwr.35 | CD.4s) | Ice Missile (Lv.15 | Pwr.30 | CD.3s) | Blizzard Spike (Lv.22 | Pwr.130 | CD.45s) | Power Bomb (Lv.30 | Pwr.70 | CD.15s) | Iceberg (Lv.40 | Pwr.70 | CD.15s) | Pal Blast (Lv.50 | Pwr.150 | CD.55s)
-1,Suddenly Transformed Gumoss,Missing...,True,False,Ground,Grass,"{'drop_rate': 100, 'min_drop': 1, 'max_drop': 1, 'item_name': 'PalCrystal_Ex'}","{'drop_rate': 100, 'min_drop': 1, 'max_drop': 1, 'item_name': 'BerrySeeds'}","While in team, improves efficiency of cutting trees.","While in team, improves efficiency of cutting trees.",Seeding(Lv.1),70,100,70,70,100,100,50,300,400,1,1,1310,50,1240,Sand Blast (Lv.1 | Pwr.40 | CD.4s) | Wind Cutter (Lv.7 | Pwr.30 | CD.2s) | Stone Blast (Lv.15 | Pwr.55 | CD.10s) | Seed Machine Gun (Lv.22 | Pwr.50 | CD.9s) | Seed Mine (Lv.30 | Pwr.65 | CD.13s) | Sand Tornado (Lv.40 | Pwr.80 | CD.18s) | Solar Blast (Lv.50 | Pwr.150 | CD.55s)
-1,Suddenly Transformed Gumoss,Missing...,True,False,Ground,Grass,"{'drop_rate': 100, 'min_drop': 1, 'max_drop': 1, 'item_name': 'PalCrystal_Ex'}","{'drop_rate': 100, 'min_drop': 1, 'max_drop': 1, 'item_name': 'Poppy'}","While in team, improves efficiency of cutting trees.","While in team, improves efficiency of cutting trees.",Seeding(Lv.1),70,100,70,70,100,100,50,300,400,1,1,1310,50,1240,Sand Blast (Lv.1 | Pwr.40 | CD.4s) | Wind Cutter (Lv.7 | Pwr.30 | CD.2s) | Stone Blast (Lv.15 | Pwr.55 | CD.10s) | Seed Machine Gun (Lv.22 | Pwr.50 | CD.9s) | Seed Mine (Lv.30 | Pwr.65 | CD.13s) | Sand Tornado (Lv.40 | Pwr.80 | CD.18s) | Solar Blast (Lv.50 | Pwr.150 | CD.55s)
-1,Empress of the Hive Elizabee,Missing...,True,False,Grass,,"{'drop_rate': 100, 'min_drop': 2, 'max_drop': 4, 'item_name': 'PalCrystal_Ex'}","{'drop_rate': 100, 'min_drop': 5, 'max_drop': 5, 'item_name': 'Honey'}","While fighting together, stats will increase the more Beegarde are in your team.","While fighting together, stats will increase the more Beegarde are in your team.","Seeding(Lv.2), Handcraft(Lv.2), Collection(Lv.2), Deforest(Lv.1), Product Medicine(Lv.2)",90,100,105,100,100,100,250,450,550,7,8,6830,10,330,Air Cannon (Lv.1 | Pwr.25 | CD.2s) | Wind Cutter (Lv.7 | Pwr.30 | CD.2s) | Poison Blast (Lv.15 | Pwr.30 | CD.2s) | Spinning Lance (Lv.22 | Pwr.70 | CD.9s) | Grass Tornado (Lv.30 | Pwr.80 | CD.18s) | Spine Vine (Lv.40 | Pwr.95 | CD.25s) | Solar Blast (Lv.50 | Pwr.150 | CD.55s)
-1,Born of the Storm Dazzi,Missing...,True,False,Electric,,"{'drop_rate': 100, 'min_drop': 1, 'max_drop': 2, 'item_name': 'PalCrystal_Ex'}","{'drop_rate': 100, 'min_drop': 1, 'max_drop': 1, 'item_name': 'ElectricOrgan'}","While in team, appears near the player. Follows up player attacks with lightning bolts.","While in team, appears near the player. Follows up player attacks with lightning bolts.","Generate Electricity(Lv.1), Handcraft(Lv.1), Transport(Lv.1)",70,110,80,70,100,100,200,400,550,2,2,1390,20,1210,Air Cannon (Lv.1 | Pwr.25 | CD.2s) | Shockwave (Lv.7 | Pwr.40 | CD.4s) | Acid Rain (Lv.15 | Pwr.80 | CD.18s) | Lightning Streak (Lv.22 | Pwr.75 | CD.16s) | Tri-Lightning (Lv.30 | Pwr.90 | CD.22s) | Lightning Strike (Lv.40 | Pwr.120 | CD.40s) | Lightning Bolt (Lv.50 | Pwr.150 | CD.55s)
-1,Wings of Inferno Ragnahawk,Missing...,True,False,Fire,,"{'drop_rate': 100, 'min_drop': 4, 'max_drop': 6, 'item_name': 'PalCrystal_Ex'}","{'drop_rate': 100, 'min_drop': 5, 'max_drop': 7, 'item_name': 'FireOrgan'}",Can be ridden as an flying mount. Applies Fire damage to the player's attacks while mounted.,Can be ridden as an flying mount. Applies Fire damage to the player's attacks while mounted.,"Emit Flame(Lv.3), Transport(Lv.3)",95,100,105,120,100,150,200,800,1400,7,7,6720,50,380,Air Cannon (Lv.1 | Pwr.25 | CD.2s) | Spirit Fire (Lv.7 | Pwr.45 | CD.7s) | Flare Arrow (Lv.15 | Pwr.55 | CD.10s) | Sand Tornado (Lv.22 | Pwr.80 | CD.18s) | Flare Storm (Lv.30 | Pwr.80 | CD.18s) | Ignis Breath (Lv.40 | Pwr.70 | CD.15s) | Fire Ball (Lv.50 | Pwr.150 | CD.55s)
-1,Vagrant Warrior Bushi,Missing...,True,False,Fire,,"{'drop_rate': 100, 'min_drop': 2, 'max_drop': 4, 'item_name': 'PalCrystal_Ex'}","{'drop_rate': 100, 'min_drop': 1, 'max_drop': 2, 'item_name': 'Bone'}","When activated, attacks targeted enemy with a powerful Iaigiri.","When activated, attacks targeted enemy with a powerful Iaigiri.","Emit Flame(Lv.2), Handcraft(Lv.1), Collection(Lv.1), Deforest(Lv.3), Transport(Lv.2)",80,100,125,80,100,100,160,600,900,4,7,4520,50,640,Ignis Blast (Lv.1 | Pwr.30 | CD.2s) | Wind Cutter (Lv.7 | Pwr.30 | CD.2s) | Icicle Cutter (Lv.15 | Pwr.55 | CD.10s) | Iaigiri (Lv.22 | Pwr.65 | CD.9s) | Ignis Breath (Lv.30 | Pwr.70 | CD.15s) | Lightning Strike (Lv.40 | Pwr.120 | CD.40s) | Ignis Rage (Lv.50 | Pwr.120 | CD.40s)
-1,Archer of the Sands Robinquill Terra,Missing...,True,False,Grass,Ground,"{'drop_rate': 100, 'min_drop': 2, 'max_drop': 4, 'item_name': 'PalCrystal_Ex'}","{'drop_rate': 50, 'min_drop': 1, 'max_drop': 2, 'item_name': 'WheatSeeds'}","While fighting together, allows you to deal more damage to weak points.","While fighting together, allows you to deal more damage to weak points.","Handcraft(Lv.2), Collection(Lv.2), Deforest(Lv.1), Product Medicine(Lv.1), Transport(Lv.2)",90,100,105,80,100,100,100,600,750,3,6,2150,50,1000,Sand Blast (Lv.1 | Pwr.40 | CD.4s) | Wind Cutter (Lv.7 | Pwr.30 | CD.2s) | Focus Shot (Lv.15 | Pwr.65 | CD.9s) | Stone Blast (Lv.22 | Pwr.55 | CD.10s) | Sand Tornado (Lv.30 | Pwr.80 | CD.18s) | Solar Blast (Lv.40 | Pwr.150 | CD.55s) | Rock Lance (Lv.50 | Pwr.150 | CD.55s)
-1,The Cat's Pajamas Cattiva,Missing...,True,False,Neutral,,"{'drop_rate': 100, 'min_drop': 1, 'max_drop': 2, 'item_name': 'PalCrystal_Ex'}","{'drop_rate': 100, 'min_drop': 1, 'max_drop': 1, 'item_name': 'Berries'}","While in team, Cattiva helps carry supplies, increasing the player's max carrying capacity.","While in team, Cattiva helps carry supplies, increasing the player's max carrying capacity.","Handcraft(Lv.1), Collection(Lv.1), Mining(Lv.1), Transport(Lv.1)",70,70,70,70,100,100,60,400,550,2,1,1000,50,1460,Punch Flurry (Lv.1 | Pwr.40 | CD.1s) | Air Cannon (Lv.7 | Pwr.25 | CD.2s) | Sand Blast (Lv.15 | Pwr.40 | CD.4s) | Power Shot (Lv.22 | Pwr.35 | CD.4s) | Wind Cutter (Lv.30 | Pwr.30 | CD.2s) | Seed Machine Gun (Lv.40 | Pwr.50 | CD.9s) | Pal Blast (Lv.50 | Pwr.150 | CD.55s)
-1,Holy Knight of Legend Paladius,Missing...,True,False,Neutral,,"{'drop_rate': 100, 'min_drop': 4, 'max_drop': 6, 'item_name': 'PalCrystal_Ex'}","{'drop_rate': 100, 'min_drop': 10, 'max_drop': 10, 'item_name': 'StealIngot'}",Can be ridden. Can triple jump while mounted.,Can be ridden. Can triple jump while mounted.,"Deforest(Lv.2), Mining(Lv.2)",260,110,120,145,100,100,100,800,1400,9,20,8810,50,80,Power Shot (Lv.1 | Pwr.35 | CD.4s) | Ice Missile (Lv.7 | Pwr.30 | CD.3s) | Iceberg (Lv.15 | Pwr.70 | CD.15s) | Power Bomb (Lv.22 | Pwr.70 | CD.15s) | Blizzard Spike (Lv.30 | Pwr.130 | CD.45s) | Spear Thrust (Lv.40 | Pwr.120 | CD.40s) | Pal Blast (Lv.50 | Pwr.150 | CD.55s)
-1,Winds of Spring Broncherry,Missing...,True,False,Grass,,"{'drop_rate': 100, 'min_drop': 1, 'max_drop': 3, 'item_name': 'PalCrystal_Ex'}","{'drop_rate': 100, 'min_drop': 2, 'max_drop': 2, 'item_name': 'Meat_SakuraSaurus'}","Can be ridden. While in team, Broncherry helps carry supplies,
increasing the player's max carrying capacity.","Can be ridden. While in team, Broncherry helps carry supplies,
increasing the player's max carrying capacity.",Seeding(Lv.3),120,80,90,100,120,100,75,350,600,7,7,2920,50,860,Wind Cutter (Lv.1 | Pwr.30 | CD.2s) | Sand Blast (Lv.7 | Pwr.40 | CD.4s) | Muscle Slam (Lv.15 | Pwr.80 | CD.12s) | Seed Mine (Lv.22 | Pwr.65 | CD.13s) | Grass Tornado (Lv.30 | Pwr.80 | CD.18s) | Spine Vine (Lv.40 | Pwr.95 | CD.25s) | Solar Blast (Lv.50 | Pwr.150 | CD.55s)
-1,Waves of Summer Broncherry Aqua,Missing...,True,False,Grass,Water,"{'drop_rate': 100, 'min_drop': 2, 'max_drop': 4, 'item_name': 'PalCrystal_Ex'}","{'drop_rate': 100, 'min_drop': 2, 'max_drop': 2, 'item_name': 'Meat_SakuraSaurus'}","Can be ridden. While in team, Broncherry Aqua helps carry supplies,
increasing the player's max carrying capacity.","Can be ridden. While in team, Broncherry Aqua helps carry supplies,
increasing the player's max carrying capacity.",Watering(Lv.3),120,80,95,100,120,100,75,350,600,7,8,3110,50,840,Aqua Gun (Lv.1 | Pwr.40 | CD.4s) | Bubble Blast (Lv.7 | Pwr.65 | CD.13s) | Muscle Slam (Lv.15 | Pwr.80 | CD.12s) | Seed Mine (Lv.22 | Pwr.65 | CD.13s) | Spine Vine (Lv.30 | Pwr.95 | CD.25s) | Aqua Burst (Lv.40 | Pwr.100 | CD.30s) | Hydro Laser (Lv.50 | Pwr.150 | CD.55s)
-1,en_Text en_text,Missing...,True,False,Dark,,"{'drop_rate': 100, 'min_drop': 2, 'max_drop': 3, 'item_name': 'PalCrystal_Ex'}","{'drop_rate': 100, 'min_drop': 4, 'max_drop': 5, 'item_name': 'Venom'}",This Pal is under investigation.,This Pal is under investigation.,"Collection(Lv.1), Deforest(Lv.3), Oil Extraction(Lv.2), Product Medicine(Lv.1)",100,100,100,100,100,100,-1,-1,-1,4,0,8080,50,0,
-1,The Ocean's Wrath Surfent,Missing...,True,False,Water,,"{'drop_rate': 100, 'min_drop': 1, 'max_drop': 2, 'item_name': 'PalCrystal_Ex'}","{'drop_rate': 100, 'min_drop': 1, 'max_drop': 2, 'item_name': 'PalFluid'}","Can be ridden to travel on water. While mounted, prevents stamina depletion
while moving over water.","Can be ridden to travel on water. While mounted, prevents stamina depletion
while moving over water.",Watering(Lv.2),90,70,90,80,100,100,200,500,750,5,4,5050,50,560,Hydro Jet (Lv.1 | Pwr.30 | CD.2s) | Dragon Cannon (Lv.7 | Pwr.30 | CD.2s) | Aqua Gun (Lv.15 | Pwr.40 | CD.4s) | Bubble Blast (Lv.22 | Pwr.65 | CD.13s) | Dragon Burst (Lv.30 | Pwr.55 | CD.10s) | Draconic Breath (Lv.40 | Pwr.70 | CD.15s) | Hydro Laser (Lv.50 | Pwr.150 | CD.55s)
-1,The Desert's Wrath Surfent Terra,Missing...,True,False,Ground,,"{'drop_rate': 100, 'min_drop': 2, 'max_drop': 3, 'item_name': 'PalCrystal_Ex'}","{'drop_rate': 100, 'min_drop': 1, 'max_drop': 2, 'item_name': 'PalFluid'}",Can be ridden.,Can be ridden.,Collection(Lv.1),90,70,90,100,100,100,200,500,750,5,5,5140,50,550,Sand Blast (Lv.1 | Pwr.40 | CD.4s) | Dragon Cannon (Lv.7 | Pwr.30 | CD.2s) | Stone Blast (Lv.15 | Pwr.55 | CD.10s) | Stone Cannon (Lv.22 | Pwr.70 | CD.15s) | Sand Tornado (Lv.30 | Pwr.80 | CD.18s) | Draconic Breath (Lv.40 | Pwr.70 | CD.15s) | Rock Lance (Lv.50 | Pwr.150 | CD.55s)
-1,Archer of the Forest Robinquill,Missing...,True,False,Grass,,"{'drop_rate': 100, 'min_drop': 2, 'max_drop': 4, 'item_name': 'PalCrystal_Ex'}","{'drop_rate': 50, 'min_drop': 1, 'max_drop': 2, 'item_name': 'WheatSeeds'}","While fighting together, allows you to deal more damage to weak points.","While fighting together, allows you to deal more damage to weak points.","Seeding(Lv.1), Handcraft(Lv.2), Collection(Lv.2), Deforest(Lv.1), Product Medicine(Lv.1), Transport(Lv.2)",90,100,105,80,100,100,100,600,750,3,0,2050,50,1020,Wind Cutter (Lv.1 | Pwr.30 | CD.2s) | Power Shot (Lv.7 | Pwr.35 | CD.4s) | Focus Shot (Lv.15 | Pwr.65 | CD.9s) | Seed Mine (Lv.22 | Pwr.65 | CD.13s) | Grass Tornado (Lv.30 | Pwr.80 | CD.18s) | Spine Vine (Lv.40 | Pwr.95 | CD.25s) | Solar Blast (Lv.50 | Pwr.150 | CD.55s)
-1,Ate Too Much Pengullet,Missing...,True,False,Ice,Water,"{'drop_rate': 100, 'min_drop': 1, 'max_drop': 2, 'item_name': 'PalCrystal_Ex'}","{'drop_rate': 100, 'min_drop': 1, 'max_drop': 2, 'item_name': 'IceOrgan'}","When activated, the player equips a Rocket Launcher and fires Pengullet as ammunition.
Pengullet explodes on contact and is incapacitated.","When activated, the player equips a Rocket Launcher and fires Pengullet as ammunition.
Pengullet explodes on contact and is incapacitated.","Watering(Lv.1), Handcraft(Lv.1), Cool(Lv.1), Transport(Lv.1)",70,70,75,70,100,100,60,500,650,2,1,1080,50,1350,Ice Missile (Lv.1 | Pwr.30 | CD.3s) | Hydro Jet (Lv.7 | Pwr.30 | CD.2s) | Aqua Gun (Lv.15 | Pwr.40 | CD.4s) | Icicle Cutter (Lv.22 | Pwr.55 | CD.10s) | Iceberg (Lv.30 | Pwr.70 | CD.15s) | Blizzard Spike (Lv.40 | Pwr.130 | CD.45s) | Hydro Laser (Lv.50 | Pwr.150 | CD.55s)
-1,Several Sleepless Nights Later Depresso,Missing...,True,False,Dark,,"{'drop_rate': 100, 'min_drop': 1, 'max_drop': 2, 'item_name': 'PalCrystal_Ex'}","{'drop_rate': 100, 'min_drop': 2, 'max_drop': 3, 'item_name': 'Venom'}","When activated, Depresso drinks a massive amount of energy drinks,
causing its movement speed to increase.","When activated, Depresso drinks a massive amount of energy drinks,
causing its movement speed to increase.","Handcraft(Lv.1), Mining(Lv.1), Transport(Lv.1)",70,70,70,70,100,100,10,300,400,2,1,1050,50,1380,Poison Blast (Lv.1 | Pwr.30 | CD.2s) | Sand Blast (Lv.7 | Pwr.40 | CD.4s) | Dark Ball (Lv.15 | Pwr.40 | CD.4s) | Ice Missile (Lv.22 | Pwr.30 | CD.3s) | Shadow Burst (Lv.30 | Pwr.55 | CD.10s) | Nightmare Ball (Lv.40 | Pwr.100 | CD.30s) | Dark Laser (Lv.50 | Pwr.150 | CD.55s)
-1,Emotionless Killamari,Missing...,True,False,Dark,,"{'drop_rate': 100, 'min_drop': 1, 'max_drop': 2, 'item_name': 'PalCrystal_Ex'}","{'drop_rate': 100, 'min_drop': 2, 'max_drop': 4, 'item_name': 'Venom'}","While in team, can be summoned and used instead of a glider. Can float for long periods of time while gliding.","While in team, can be summoned and used instead of a glider. Can float for long periods of time while gliding.","Collection(Lv.1), Transport(Lv.2)",60,100,60,70,100,100,120,400,550,3,1,1200,50,1290,Hydro Jet (Lv.1 | Pwr.30 | CD.2s) | Poison Blast (Lv.7 | Pwr.30 | CD.2s) | Dark Ball (Lv.15 | Pwr.40 | CD.4s) | Shadow Burst (Lv.22 | Pwr.55 | CD.10s) | Acid Rain (Lv.30 | Pwr.80 | CD.18s) | Nightmare Ball (Lv.40 | Pwr.100 | CD.30s) | Dark Laser (Lv.50 | Pwr.150 | CD.55s)
-1,Revealer of Paths Foxparks,Missing...,True,False,Fire,,"{'drop_rate': 100, 'min_drop': 1, 'max_drop': 2, 'item_name': 'PalCrystal_Ex'}","{'drop_rate': 100, 'min_drop': 1, 'max_drop': 1, 'item_name': 'Leather'}","When activated, equips to the player and transforms into a flamethrower.","When activated, equips to the player and transforms into a flamethrower.",Emit Flame(Lv.1),65,70,75,70,100,100,80,400,550,2,1,2560,50,1400,Ignis Blast (Lv.1 | Pwr.30 | CD.2s) | Sand Blast (Lv.7 | Pwr.40 | CD.4s) | Spirit Fire (Lv.15 | Pwr.45 | CD.7s) | Flare Arrow (Lv.22 | Pwr.55 | CD.10s) | Ignis Breath (Lv.30 | Pwr.70 | CD.15s) | Spirit Flame (Lv.40 | Pwr.75 | CD.16s) | Fire Ball (Lv.50 | Pwr.150 | CD.55s)
-1,Molten Daughter Flambelle,Missing...,True,False,Fire,,"{'drop_rate': 100, 'min_drop': 1, 'max_drop': 3, 'item_name': 'PalCrystal_Ex'}","{'drop_rate': 100, 'min_drop': 2, 'max_drop': 3, 'item_name': 'FireOrgan'}",Sometimes produces Flame Organ when assigned to Ranch.,Sometimes produces Flame Organ when assigned to Ranch.,"Emit Flame(Lv.1), Handcraft(Lv.1), Transport(Lv.1), Monster Farm(Lv.1)",60,100,70,80,100,100,98,250,375,2,1,2500,50,1405,
-1,Perpetual Procrastinator Dumud,Missing...,True,False,Ground,,"{'drop_rate': 100, 'min_drop': 4, 'max_drop': 6, 'item_name': 'PalCrystal_Ex'}","{'drop_rate': 100, 'min_drop': 2, 'max_drop': 2, 'item_name': 'Meat_LazyCatfish'}","While in team, increases attack power of Ground Pals.","While in team, increases attack power of Ground Pals.","Watering(Lv.1), Mining(Lv.2), Oil Extraction(Lv.1), Transport(Lv.1)",100,100,70,95,100,100,150,450,600,4,4,4690,50,895,
-1,Gluttonous Dragon Relaxaurus,Missing...,True,False,Dragon,Water,"{'drop_rate': 100, 'min_drop': 2, 'max_drop': 4, 'item_name': 'PalCrystal_Ex'}","{'drop_rate': 100, 'min_drop': 1, 'max_drop': 4, 'item_name': 'PalOil'}",Can be ridden. Can rapidly fire a missile launcher while mounted.,Can be ridden. Can rapidly fire a missile launcher while mounted.,"Watering(Lv.2), Transport(Lv.1)",110,110,100,70,100,100,60,650,900,7,8,10240,50,280,Dragon Cannon (Lv.1 | Pwr.30 | CD.2s) | Aqua Gun (Lv.7 | Pwr.40 | CD.4s) | Dragon Burst (Lv.15 | Pwr.55 | CD.10s) | Bubble Blast (Lv.22 | Pwr.65 | CD.13s) | Draconic Breath (Lv.30 | Pwr.70 | CD.15s) | Aqua Burst (Lv.40 | Pwr.100 | CD.30s) | Dragon Meteor (Lv.50 | Pwr.150 | CD.55s)
-1,Gluttonous Thunder Dragon Relaxaurus Lux,Missing...,True,False,Dragon,Electric,"{'drop_rate': 100, 'min_drop': 3, 'max_drop': 5, 'item_name': 'PalCrystal_Ex'}","{'drop_rate': 100, 'min_drop': 1, 'max_drop': 4, 'item_name': 'PalOil'}",Can be ridden. Can rapidly fire a missile launcher while mounted.,Can be ridden. Can rapidly fire a missile launcher while mounted.,"Generate Electricity(Lv.3), Transport(Lv.1)",110,110,110,75,100,100,60,650,900,7,9,10380,50,270,Spark Blast (Lv.1 | Pwr.30 | CD.2s) | Dragon Cannon (Lv.7 | Pwr.30 | CD.2s) | Shockwave (Lv.15 | Pwr.40 | CD.4s) | Lightning Streak (Lv.22 | Pwr.75 | CD.16s) | Draconic Breath (Lv.30 | Pwr.70 | CD.15s) | Lightning Strike (Lv.40 | Pwr.120 | CD.40s) | Lightning Bolt (Lv.50 | Pwr.150 | CD.55s)
-1,Lily Empress Lyleen,Missing...,True,False,Grass,,"{'drop_rate': 100, 'min_drop': 4, 'max_drop': 6, 'item_name': 'PalCrystal_Ex'}","{'drop_rate': 100, 'min_drop': 3, 'max_drop': 3, 'item_name': 'Herbs'}","When activated, the queen's soothing graces greatly restore the player's HP.","When activated, the queen's soothing graces greatly restore the player's HP.","Seeding(Lv.4), Handcraft(Lv.3), Collection(Lv.2), Product Medicine(Lv.3)",110,100,110,105,100,100,100,450,550,6,9,7160,30,250,Wind Cutter (Lv.1 | Pwr.30 | CD.2s) | Seed Machine Gun (Lv.7 | Pwr.50 | CD.9s) | Seed Mine (Lv.15 | Pwr.65 | CD.13s) | Aqua Burst (Lv.22 | Pwr.100 | CD.30s) | Grass Tornado (Lv.30 | Pwr.80 | CD.18s) | Spine Vine (Lv.40 | Pwr.95 | CD.25s) | Solar Blast (Lv.50 | Pwr.150 | CD.55s)
-1,Empress of the Abyss Lyleen Noct,Missing...,True,False,Dark,,"{'drop_rate': 100, 'min_drop': 5, 'max_drop': 7, 'item_name': 'PalCrystal_Ex'}","{'drop_rate': 100, 'min_drop': 3, 'max_drop': 3, 'item_name': 'Herbs'}","When activated, the queen's soothing graces greatly restore the player's HP.","When activated, the queen's soothing graces greatly restore the player's HP.","Handcraft(Lv.3), Collection(Lv.2), Product Medicine(Lv.3)",110,100,110,115,100,100,100,450,550,6,10,7610,30,210,Dark Ball (Lv.1 | Pwr.40 | CD.4s) | Icicle Cutter (Lv.7 | Pwr.55 | CD.10s) | Shadow Burst (Lv.15 | Pwr.55 | CD.10s) | Cryst Breath (Lv.22 | Pwr.90 | CD.22s) | Nightmare Ball (Lv.30 | Pwr.100 | CD.30s) | Blizzard Spike (Lv.40 | Pwr.130 | CD.45s) | Dark Laser (Lv.50 | Pwr.150 | CD.55s)
-1,Thorny Rose Bristla,Missing...,True,False,Grass,,"{'drop_rate': 100, 'min_drop': 2, 'max_drop': 4, 'item_name': 'PalCrystal_Ex'}","{'drop_rate': 100, 'min_drop': 1, 'max_drop': 2, 'item_name': 'WheatSeeds'}","While in team, increases attack power of Grass Pals.","While in team, increases attack power of Grass Pals.","Seeding(Lv.1), Handcraft(Lv.1), Collection(Lv.1), Product Medicine(Lv.2), Transport(Lv.1)",80,80,80,80,100,100,100,400,550,5,1,1140,50,1320,Wind Cutter (Lv.1 | Pwr.30 | CD.2s) | Seed Machine Gun (Lv.7 | Pwr.50 | CD.9s) | Ice Missile (Lv.15 | Pwr.30 | CD.3s) | Grass Tornado (Lv.22 | Pwr.80 | CD.18s) | Iceberg (Lv.30 | Pwr.70 | CD.15s) | Spine Vine (Lv.40 | Pwr.95 | CD.25s) | Solar Blast (Lv.50 | Pwr.150 | CD.55s)
-1,Dusken Aristocrat Nox,Missing...,True,False,Dark,,"{'drop_rate': 100, 'min_drop': 2, 'max_drop': 3, 'item_name': 'PalCrystal_Ex'}","{'drop_rate': 100, 'min_drop': 1, 'max_drop': 1, 'item_name': 'Leather'}","When fighting together, applies Dark damage to the player's attacks.","When fighting together, applies Dark damage to the player's attacks.",Collection(Lv.1),75,70,85,70,140,100,60,300,500,2,6,1480,50,1180,Air Cannon (Lv.1 | Pwr.25 | CD.2s) | Dark Ball (Lv.7 | Pwr.40 | CD.4s) | Shadow Burst (Lv.15 | Pwr.55 | CD.10s) | Power Bomb (Lv.22 | Pwr.70 | CD.15s) | Spirit Flame (Lv.30 | Pwr.75 | CD.16s) | Nightmare Ball (Lv.40 | Pwr.100 | CD.30s) | Dark Laser (Lv.50 | Pwr.150 | CD.55s)
-1,Self-proclaimed Genius Leezpunk,Missing...,True,False,Dark,,"{'drop_rate': 100, 'min_drop': 1, 'max_drop': 2, 'item_name': 'PalCrystal_Ex'}","{'drop_rate': 100, 'min_drop': 1, 'max_drop': 1, 'item_name': 'TreasureBoxKey01'}","When activated, utilizes its sixth sense to detect nearby dungeons.","When activated, utilizes its sixth sense to detect nearby dungeons.","Handcraft(Lv.1), Collection(Lv.1), Transport(Lv.1)",80,90,80,50,100,100,140,600,800,3,2,1720,50,1120,Poison Blast (Lv.1 | Pwr.30 | CD.2s) | Dark Ball (Lv.7 | Pwr.40 | CD.4s) | Shadow Burst (Lv.15 | Pwr.55 | CD.10s) | Spirit Flame (Lv.22 | Pwr.75 | CD.16s) | Nightmare Ball (Lv.30 | Pwr.100 | CD.30s) | Ignis Breath (Lv.40 | Pwr.70 | CD.15s) | Dark Laser (Lv.50 | Pwr.150 | CD.55s)
