pal_index,pal_name,pal_description,is_boss,is_tower_boss,element_1,element_2,item_drop_1,item_drop_2,partner_skill_title,partner_skill_description,work_suitability,stats_hp,stats_melee_attack,stats_shot_attack,stats_defense,stats_support,stats_stamina,stats_walk_speed,stats_run_speed,stats_ride_sprint_speed,stats_food_amount,stats_rarity,stats_price,male_probability,combi_rank,active_skills
48,Robinquill,"A pal that is very similar to humans who hunt and live in the forests. It may prove to be a key for understanding what Pals are
and how they diverged from humans so long ago.",False,False,Grass,,"{'drop_rate': 50, 'min_drop': 1, 'max_drop': 2, 'item_name': 'WheatSeeds'}","{'drop_rate': 100, 'min_drop': 2, 'max_drop': 4, 'item_name': 'Arrow'}",Hawk Eye,"While fighting together, allows you to deal more damage to weak points.","Seeding(Lv.1), Handcraft(Lv.2), Collection(Lv.2), Deforest(Lv.1), Product Medicine(Lv.1), Transport(Lv.2)",90,100,105,80,100,100,100,600,750,3,5,2050,50,1020,Wind Cutter (Lv.1 | Pwr.30 | CD.2s) | Power Shot (Lv.7 | Pwr.35 | CD.4s) | Focus Shot (Lv.15 | Pwr.65 | CD.9s) | Seed Mine (Lv.22 | Pwr.65 | CD.13s) | Grass Tornado (Lv.30 | Pwr.80 | CD.18s) | Spine Vine (Lv.40 | Pwr.95 | CD.25s) | Solar Blast (Lv.50 | Pwr.150 | CD.55s)
49,Gorirat,"It beats the ground rhythmically to communicate with its comrades. The meaning of each rhythm differs by troop, but the distinction
between them is still largely unknown.",False,False,Neutral,,"{'drop_rate': 100, 'min_drop': 1, 'max_drop': 2, 'item_name': 'Leather'}","{'drop_rate': 100, 'min_drop': 1, 'max_drop': 1, 'item_name': 'Bone'}",Full-power Gorilla Mode,"When activated, unleashes a primal fury that increases Gorirat's attack power.","Handcraft(Lv.1), Deforest(Lv.2), Transport(Lv.3)",90,110,95,90,100,100,100,550,720,3,5,2010,50,1040,Sand Blast (Lv.1 | Pwr.40 | CD.4s) | Power Shot (Lv.7 | Pwr.35 | CD.4s) | Ground Pound (Lv.15 | Pwr.85 | CD.14s) | Stone Blast (Lv.22 | Pwr.55 | CD.10s) | Seed Machine Gun (Lv.30 | Pwr.50 | CD.9s) | Power Bomb (Lv.40 | Pwr.70 | CD.15s) | Pal Blast (Lv.50 | Pwr.150 | CD.55s)
50,Beegarde,"A servant that pledges loyalty to Elizabee. Any that cause harm to the queen are immediately expelled from the hive.
It will gladly give its life to protect its queen.",False,False,Grass,,"{'drop_rate': 100, 'min_drop': 1, 'max_drop': 2, 'item_name': 'Honey'}",,Worker Bee,"Sometimes drops Honey when assigned to Ranch.
While in team, Elizabee's stats will be increased.","Seeding(Lv.1), Handcraft(Lv.1), Collection(Lv.1), Deforest(Lv.1), Product Medicine(Lv.1), Transport(Lv.2), Monster Farm(Lv.1)",80,100,90,90,100,100,250,450,550,3,4,1880,10,1070,Air Cannon (Lv.1 | Pwr.25 | CD.2s) | Wind Cutter (Lv.7 | Pwr.30 | CD.2s) | Bee Quiet (Lv.15 | Pwr.200 | CD.55s) | Poison Blast (Lv.22 | Pwr.30 | CD.2s) | Acid Rain (Lv.30 | Pwr.80 | CD.18s) | Grass Tornado (Lv.40 | Pwr.80 | CD.18s) | Solar Blast (Lv.50 | Pwr.150 | CD.55s)
51,Elizabee,"A chosen queen to rule over Beegardes. There is a never ending stream of servants willing to work themselves to death
for the pleasure of serving their queen.",False,False,Grass,,"{'drop_rate': 100, 'min_drop': 5, 'max_drop': 5, 'item_name': 'Honey'}","{'drop_rate': 3, 'min_drop': 1, 'max_drop': 1, 'item_name': 'Spear_QueenBee'}",Queen Bee Command,"While fighting together, stats will increase the more Beegarde are in your team.","Seeding(Lv.2), Handcraft(Lv.2), Collection(Lv.2), Deforest(Lv.1), Product Medicine(Lv.2)",90,100,105,100,100,100,250,450,550,7,8,6830,10,330,Air Cannon (Lv.1 | Pwr.25 | CD.2s) | Wind Cutter (Lv.7 | Pwr.30 | CD.2s) | Poison Blast (Lv.15 | Pwr.30 | CD.2s) | Spinning Lance (Lv.22 | Pwr.70 | CD.9s) | Grass Tornado (Lv.30 | Pwr.80 | CD.18s) | Spine Vine (Lv.40 | Pwr.95 | CD.25s) | Solar Blast (Lv.50 | Pwr.150 | CD.55s)
52,Grintale,"Grintale's eyes light up the moment anyone enters its territory.
This is no figure of speech—its eyes literally light up.",False,False,Neutral,,"{'drop_rate': 100, 'min_drop': 1, 'max_drop': 3, 'item_name': 'PalOil'}",,Plump Body,Can be ridden. Enhances Neutral attacks while mounted.,Collection(Lv.2),110,100,80,80,100,100,64,600,800,4,6,5510,50,510,Sand Blast (Lv.1 | Pwr.40 | CD.4s) | Power Shot (Lv.7 | Pwr.35 | CD.4s) | Cat Press (Lv.15 | Pwr.60 | CD.9s) | Stone Blast (Lv.22 | Pwr.55 | CD.10s) | Stone Cannon (Lv.30 | Pwr.70 | CD.15s) | Power Bomb (Lv.40 | Pwr.70 | CD.15s) | Pal Blast (Lv.50 | Pwr.150 | CD.55s)
53,Swee,"Crawling along the ground, it eats microscopic organic matter. After a while, it discharges any substances that provide no nutrition.
By using it as a mop for cleaning, everyone wins!",False,False,Ice,,"{'drop_rate': 100, 'min_drop': 1, 'max_drop': 1, 'item_name': 'Wool'}",,Fluffy,"While in team, Sweepa's stats will be increased.","Collection(Lv.1), Cool(Lv.1)",60,100,60,60,100,100,100,250,400,2,1,1180,50,1300,Air Cannon (Lv.1 | Pwr.25 | CD.2s) | Ice Missile (Lv.7 | Pwr.30 | CD.3s) | Icicle Cutter (Lv.15 | Pwr.55 | CD.10s) | Power Bomb (Lv.22 | Pwr.70 | CD.15s) | Iceberg (Lv.30 | Pwr.70 | CD.15s) | Cryst Breath (Lv.40 | Pwr.90 | CD.22s) | Blizzard Spike (Lv.50 | Pwr.130 | CD.45s)
54,Sweepa,"While hibernating, a large number of Swee hide within its voluminous body hair.
The most ever recorded is 101.",False,False,Ice,,"{'drop_rate': 100, 'min_drop': 3, 'max_drop': 5, 'item_name': 'Wool'}",,King of Fluff,"Can be ridden. While fighting together, stats will increase the more Swee are in your team.","Collection(Lv.2), Cool(Lv.2)",100,100,90,90,100,100,120,300,500,3,6,6400,50,410,Power Shot (Lv.1 | Pwr.35 | CD.4s) | Ice Missile (Lv.7 | Pwr.30 | CD.3s) | Icicle Cutter (Lv.15 | Pwr.55 | CD.10s) | Iceberg (Lv.22 | Pwr.70 | CD.15s) | Cryst Breath (Lv.30 | Pwr.90 | CD.22s) | Pal Blast (Lv.40 | Pwr.150 | CD.55s) | Blizzard Spike (Lv.50 | Pwr.130 | CD.45s)
55,Chillet,"It can curl up its body and roll around at extremely high speeds. Long ago, people would tie bags of milk to domesticated
Chillet as they grazed to produce butter
using this spinning force.",False,False,Ice,Dragon,"{'drop_rate': 100, 'min_drop': 2, 'max_drop': 3, 'item_name': 'Leather'}",,Wriggling Weasel,Can be ridden. Applies Dragon damage to the player's attacks while mounted.,"Collection(Lv.1), Cool(Lv.1)",90,100,80,80,100,100,180,600,800,3,4,3450,50,800,Ice Missile (Lv.1 | Pwr.30 | CD.3s) | Dragon Cannon (Lv.7 | Pwr.30 | CD.2s) | Dragon Burst (Lv.15 | Pwr.55 | CD.10s) | Icicle Cutter (Lv.22 | Pwr.55 | CD.10s) | Draconic Breath (Lv.30 | Pwr.70 | CD.15s) | Cryst Breath (Lv.40 | Pwr.90 | CD.22s) | Dragon Meteor (Lv.50 | Pwr.150 | CD.55s)
56,Univolt,"It used to be considered an emissary of the Thunder God, and thus was not hunted by people. However, after witnesses observed one die from a lightning strike,
its reverence faded, and it quite literally fell into the role of a workhorse.",False,False,Electric,,"{'drop_rate': 100, 'min_drop': 2, 'max_drop': 2, 'item_name': 'Leather'}","{'drop_rate': 100, 'min_drop': 1, 'max_drop': 1, 'item_name': 'ElectricOrgan'}",Swift Deity,"Can be ridden. Applies Electric damage
to the player's attacks while mounted.","Generate Electricity(Lv.2), Deforest(Lv.1)",80,110,105,105,100,100,130,720,1100,5,5,4280,50,680,Spark Blast (Lv.1 | Pwr.30 | CD.2s) | Shockwave (Lv.7 | Pwr.40 | CD.4s) | Lock-on Laser (Lv.15 | Pwr.70 | CD.15s) | Lightning Streak (Lv.22 | Pwr.75 | CD.16s) | Tri-Lightning (Lv.30 | Pwr.90 | CD.22s) | Lightning Strike (Lv.40 | Pwr.120 | CD.40s) | Lightning Bolt (Lv.50 | Pwr.150 | CD.55s)
57,Foxcicle,"On nights when the aurora is visible, it looks up towards the sky and begins to howl a beautiful song.
This does, however, leave it vulnerable to attacks from enemies.",False,False,Ice,,"{'drop_rate': 100, 'min_drop': 1, 'max_drop': 1, 'item_name': 'Leather'}","{'drop_rate': 100, 'min_drop': 2, 'max_drop': 3, 'item_name': 'IceOrgan'}",Aurora Guide,"While in team, increases attack power of Ice Pals.",Cool(Lv.2),90,100,95,105,100,100,130,600,750,3,5,3730,50,760,Air Cannon (Lv.1 | Pwr.25 | CD.2s) | Ice Missile (Lv.7 | Pwr.30 | CD.3s) | Icicle Cutter (Lv.15 | Pwr.55 | CD.10s) | Spirit Flame (Lv.22 | Pwr.75 | CD.16s) | Iceberg (Lv.30 | Pwr.70 | CD.15s) | Cryst Breath (Lv.40 | Pwr.90 | CD.22s) | Blizzard Spike (Lv.50 | Pwr.130 | CD.45s)
58,Pyrin,"Its entire body has evolved into a highly efficient radiator, gifting it with astounding stamina.
When someone has mounted it, this Pal takes caution not to burn them.",False,False,Fire,,"{'drop_rate': 100, 'min_drop': 4, 'max_drop': 5, 'item_name': 'FireOrgan'}","{'drop_rate': 100, 'min_drop': 2, 'max_drop': 3, 'item_name': 'Leather'}",Red Hare,"Can be ridden. Applies Fire damage
to the player's attacks while mounted.","Emit Flame(Lv.2), Deforest(Lv.1)",100,110,95,90,100,100,150,850,1300,5,6,6720,50,360,Sand Blast (Lv.1 | Pwr.40 | CD.4s) | Ignis Blast (Lv.7 | Pwr.30 | CD.2s) | Spirit Fire (Lv.15 | Pwr.45 | CD.7s) | Flare Arrow (Lv.22 | Pwr.55 | CD.10s) | Ignis Slam (Lv.30 | Pwr.85 | CD.14s) | Ignis Rage (Lv.40 | Pwr.120 | CD.40s) | Fire Ball (Lv.50 | Pwr.150 | CD.55s)
59,Reindrix,"Its transparent cerulean antlers glow with the cold of absolute zero. Any who touch them with their bare hands are instantly frozen over
and smashed to pieces.",False,False,Ice,,"{'drop_rate': 100, 'min_drop': 2, 'max_drop': 2, 'item_name': 'Meat_IceDeer'}","{'drop_rate': 100, 'min_drop': 1, 'max_drop': 1, 'item_name': 'Leather'}",Cool Body,Can be ridden. Keeps the rider cool in hot environments.,"Deforest(Lv.2), Cool(Lv.2)",100,80,85,110,100,100,70,550,700,7,4,2800,50,880,Air Cannon (Lv.1 | Pwr.25 | CD.2s) | Ice Missile (Lv.7 | Pwr.30 | CD.3s) | Icicle Cutter (Lv.15 | Pwr.55 | CD.10s) | Freezing Charge (Lv.22 | Pwr.65 | CD.9s) | Iceberg (Lv.30 | Pwr.70 | CD.15s) | Cryst Breath (Lv.40 | Pwr.90 | CD.22s) | Blizzard Spike (Lv.50 | Pwr.130 | CD.45s)
60,Rayhound,"At full speed, it could be mistaken for a bolt of lightning. If two Rayhounds collide, the sound is like that
of a powerful thunderclap.",False,False,Electric,,"{'drop_rate': 100, 'min_drop': 1, 'max_drop': 2, 'item_name': 'ElectricOrgan'}",,Jumping Force,Can be ridden. Can double jump while mounted.,Generate Electricity(Lv.2),90,100,100,80,100,100,210,700,1150,5,5,3880,50,740,Sand Blast (Lv.1 | Pwr.40 | CD.4s) | Shockwave (Lv.7 | Pwr.40 | CD.4s) | Spark Blast (Lv.15 | Pwr.30 | CD.2s) | Stone Blast (Lv.22 | Pwr.55 | CD.10s) | Electric Ball (Lv.30 | Pwr.50 | CD.9s) | Lightning Streak (Lv.40 | Pwr.75 | CD.16s) | Lightning Bolt (Lv.50 | Pwr.150 | CD.55s)
61,Kitsun,"Despite its appearance, Kitsun is extremely sensitive and will flee into a cave when spooked. Long ago, it was considered an ill omen if one were found nearby.",False,False,Fire,,"{'drop_rate': 100, 'min_drop': 2, 'max_drop': 3, 'item_name': 'FireOrgan'}","{'drop_rate': 100, 'min_drop': 2, 'max_drop': 3, 'item_name': 'Leather'}",Clear Mind,Can be ridden. Unaffected by the cold or heat while riding this Pal.,Emit Flame(Lv.2),100,70,115,100,110,100,130,700,900,4,6,3170,50,830,Ignis Blast (Lv.1 | Pwr.30 | CD.2s) | Spirit Fire (Lv.7 | Pwr.45 | CD.7s) | Spirit Flame (Lv.15 | Pwr.75 | CD.16s) | Daring Flames (Lv.22 | Pwr.75 | CD.10s) | Flare Storm (Lv.30 | Pwr.80 | CD.18s) | Ignis Rage (Lv.40 | Pwr.120 | CD.40s) | Fire Ball (Lv.50 | Pwr.150 | CD.55s)
62,Dazzi,"Often kind to lonely pals. However, the moment a Pal mistakes this for actual companionship,
it seizes the opportunity to blast them with a thunderbolt.",False,False,Electric,,"{'drop_rate': 100, 'min_drop': 1, 'max_drop': 1, 'item_name': 'ElectricOrgan'}",,Lady of Lightning,"While in team, appears near the player. Follows up player attacks with lightning bolts.","Generate Electricity(Lv.1), Handcraft(Lv.1), Transport(Lv.1)",70,110,80,70,100,100,200,400,550,2,2,1390,20,1210,Air Cannon (Lv.1 | Pwr.25 | CD.2s) | Shockwave (Lv.7 | Pwr.40 | CD.4s) | Acid Rain (Lv.15 | Pwr.80 | CD.18s) | Lightning Streak (Lv.22 | Pwr.75 | CD.16s) | Tri-Lightning (Lv.30 | Pwr.90 | CD.22s) | Lightning Strike (Lv.40 | Pwr.120 | CD.40s) | Lightning Bolt (Lv.50 | Pwr.150 | CD.55s)
63,Lunaris,"It can control those who carelessly stare into its eyes. Those seen with a Lunaris are in its mind,
simply under its control.",False,False,Neutral,,"{'drop_rate': 100, 'min_drop': 2, 'max_drop': 3, 'item_name': 'Pal_crystal_S'}",,Antigravity,"While in team, Lunaris manipulates gravity, increasing the player's max carrying capacity.","Handcraft(Lv.3), Collection(Lv.1), Transport(Lv.1)",90,80,100,90,100,100,130,500,650,2,6,1760,50,1110,Air Cannon (Lv.1 | Pwr.25 | CD.2s) | Power Shot (Lv.7 | Pwr.35 | CD.4s) | Icicle Cutter (Lv.15 | Pwr.55 | CD.10s) | Plasma Tornado (Lv.22 | Pwr.65 | CD.13s) | Power Bomb (Lv.30 | Pwr.70 | CD.15s) | Blizzard Spike (Lv.40 | Pwr.130 | CD.45s) | Pal Blast (Lv.50 | Pwr.150 | CD.55s)
64,Dinossom,A Pal who once angered cannot be pacified. It rages on and on like an inferno. The phrase |step on a Dinossom's tail| has come to mean enraging someone.,False,False,Grass,Dragon,"{'drop_rate': 50, 'min_drop': 1, 'max_drop': 2, 'item_name': 'WheatSeeds'}",,Fragrant Dragon,Can be ridden. Enhances Grass attacks while mounted.,"Seeding(Lv.2), Deforest(Lv.2)",110,90,85,90,150,100,120,550,700,6,6,3240,50,820,Wind Cutter (Lv.1 | Pwr.30 | CD.2s) | Botanical Smash (Lv.7 | Pwr.60 | CD.8s) | Dragon Burst (Lv.15 | Pwr.55 | CD.10s) | Seed Mine (Lv.22 | Pwr.65 | CD.13s) | Draconic Breath (Lv.30 | Pwr.70 | CD.15s) | Spine Vine (Lv.40 | Pwr.95 | CD.25s) | Solar Blast (Lv.50 | Pwr.150 | CD.55s)
65,Surfent,Its hydrodynamic form is well suited to life in water. Poachers often catch them and use them in place of surfboards.,False,False,Water,,"{'drop_rate': 100, 'min_drop': 1, 'max_drop': 2, 'item_name': 'PalFluid'}",,Swift Swimmer,"Can be ridden to travel on water. While mounted, prevents stamina depletion
while moving over water.",Watering(Lv.2),90,70,90,80,100,100,200,500,650,5,4,5050,50,560,Hydro Jet (Lv.1 | Pwr.30 | CD.2s) | Dragon Cannon (Lv.7 | Pwr.30 | CD.2s) | Aqua Gun (Lv.15 | Pwr.40 | CD.4s) | Bubble Blast (Lv.22 | Pwr.65 | CD.13s) | Dragon Burst (Lv.30 | Pwr.55 | CD.10s) | Draconic Breath (Lv.40 | Pwr.70 | CD.15s) | Hydro Laser (Lv.50 | Pwr.150 | CD.55s)
66,Maraith,"It relishes the peculiar scent living things give off when they are near death. If a Maraith has taken a liking to you,
it is safe to assume that is why.",False,False,Dark,,"{'drop_rate': 100, 'min_drop': 1, 'max_drop': 2, 'item_name': 'Bone'}","{'drop_rate': 15, 'min_drop': 1, 'max_drop': 1, 'item_name': 'PalUpgradeStone'}",Messenger of Death,"Can be ridden. Applies Dark damage
to the player's attacks while mounted.","Collection(Lv.2), Mining(Lv.1)",75,50,105,80,100,100,160,600,800,3,6,1570,50,1150,Ignis Blast (Lv.1 | Pwr.30 | CD.2s) | Dark Ball (Lv.7 | Pwr.40 | CD.4s) | Flare Arrow (Lv.15 | Pwr.55 | CD.10s) | Shadow Burst (Lv.22 | Pwr.55 | CD.10s) | Spirit Flame (Lv.30 | Pwr.75 | CD.16s) | Nightmare Ball (Lv.40 | Pwr.100 | CD.30s) | Dark Laser (Lv.50 | Pwr.150 | CD.55s)
67,Digtoise,"A walking contradiction, possessing the strongest shell and the only drill capable of piercing it. |Digtoise's Fable| is a popular children's tale.",False,False,Ground,,"{'drop_rate': 100, 'min_drop': 2, 'max_drop': 3, 'item_name': 'CopperOre'}","{'drop_rate': 100, 'min_drop': 2, 'max_drop': 3, 'item_name': 'PalOil'}",Drill Crusher,"When activated, performs Shell Spin, follows the player while spinning, and mines ores efficiently.",Mining(Lv.3),80,80,95,120,100,100,120,300,420,5,5,2980,50,850,Aqua Gun (Lv.1 | Pwr.40 | CD.4s) | Stone Blast (Lv.7 | Pwr.55 | CD.10s) | Shell Spin (Lv.15 | Pwr.65 | CD.9s) | Stone Cannon (Lv.22 | Pwr.70 | CD.15s) | Sand Tornado (Lv.30 | Pwr.80 | CD.18s) | Aqua Burst (Lv.40 | Pwr.100 | CD.30s) | Rock Lance (Lv.50 | Pwr.150 | CD.55s)
68,Tombat,"Often appears out of the blue to flaunt its prized wings in front of other Pals. Although this appears to be an intimidation tactic, 
the Pal seems to derive some kind of pleasure from the display.",False,False,Dark,,"{'drop_rate': 100, 'min_drop': 1, 'max_drop': 2, 'item_name': 'Leather'}","{'drop_rate': 1, 'min_drop': 1, 'max_drop': 1, 'item_name': 'PalUpgradeStone'}",Ultrasonic Sensor,"When activated, uses ultrasonic waves to detect the location of nearby Pals.","Collection(Lv.2), Mining(Lv.2), Transport(Lv.2)",95,100,95,80,100,100,140,400,550,5,5,3810,50,750,Air Cannon (Lv.1 | Pwr.25 | CD.2s) | Poison Blast (Lv.7 | Pwr.30 | CD.2s) | Dark Ball (Lv.15 | Pwr.40 | CD.4s) | Shadow Burst (Lv.22 | Pwr.55 | CD.10s) | Spirit Flame (Lv.30 | Pwr.75 | CD.16s) | Nightmare Ball (Lv.40 | Pwr.100 | CD.30s) | Dark Laser (Lv.50 | Pwr.150 | CD.55s)
69,Lovander,"Seeking a night of love, it is always chasing someone around. At first it only showed interest in other Pals, but in recent years
even humans have become the target of its debauchery.",False,False,Neutral,,"{'drop_rate': 100, 'min_drop': 2, 'max_drop': 4, 'item_name': 'Mushroom'}","{'drop_rate': 1, 'min_drop': 1, 'max_drop': 1, 'item_name': 'Cake'}",Heart Drain,"While fighting together, grants the player and Lovander the life steal effect which absorbs some of the received damage and restores HP.","Handcraft(Lv.2), Mining(Lv.1), Product Medicine(Lv.2), Transport(Lv.2)",120,70,70,70,140,100,170,750,850,5,5,2450,30,940,Power Shot (Lv.1 | Pwr.35 | CD.4s) | Poison Blast (Lv.7 | Pwr.30 | CD.2s) | Shadow Burst (Lv.15 | Pwr.55 | CD.10s) | Acid Rain (Lv.22 | Pwr.80 | CD.18s) | Power Bomb (Lv.30 | Pwr.70 | CD.15s) | Implode (Lv.40 | Pwr.180 | CD.55s) | Pal Blast (Lv.50 | Pwr.150 | CD.55s)
70,Flambelle,"When it starts crying, this Pal produces magma in place of tears. The magma that pours out is absorbed back into its body, causing it to get hotter and hotter.
The more it cries, the stronger it becomes.",False,False,Fire,,"{'drop_rate': 100, 'min_drop': 2, 'max_drop': 3, 'item_name': 'FireOrgan'}","{'drop_rate': 100, 'min_drop': 1, 'max_drop': 1, 'item_name': 'PalOil'}",Magma Tears,Sometimes produces Flame Organ when assigned to Ranch.,"Emit Flame(Lv.1), Handcraft(Lv.1), Transport(Lv.1), Monster Farm(Lv.1)",60,100,70,80,100,100,98,250,375,2,1,2500,50,1405,Ignis Blast (Lv.1 | Pwr.30 | CD.2s) | Spirit Fire (Lv.7 | Pwr.45 | CD.7s) | Flare Arrow (Lv.15 | Pwr.55 | CD.10s) | Spirit Flame (Lv.22 | Pwr.75 | CD.16s) | Flare Storm (Lv.30 | Pwr.80 | CD.18s) | Ignis Rage (Lv.40 | Pwr.120 | CD.40s) | Fire Ball (Lv.50 | Pwr.150 | CD.55s)
71,Vanwyrm,"The melodies of a flute made from the exoskeleton of a Vanwyrm are said to cross whole mountain ranges.
In ages past, such flutes were used to signal an attack.",False,False,Fire,Dark,"{'drop_rate': 100, 'min_drop': 1, 'max_drop': 2, 'item_name': 'Bone'}","{'drop_rate': 1, 'min_drop': 1, 'max_drop': 2, 'item_name': 'Ruby'}",Aerial Marauder,"Can be ridden as an flying mount. Increases damage player deals
to enemy weak points while mounted.","Emit Flame(Lv.1), Transport(Lv.3)",90,100,115,90,100,150,350,700,850,6,4,4360,50,660,Air Cannon (Lv.1 | Pwr.25 | CD.2s) | Ignis Blast (Lv.7 | Pwr.30 | CD.2s) | Spirit Fire (Lv.15 | Pwr.45 | CD.7s) | Ignis Breath (Lv.22 | Pwr.70 | CD.15s) | Nightmare Ball (Lv.30 | Pwr.100 | CD.30s) | Fire Ball (Lv.40 | Pwr.150 | CD.55s) | Dark Laser (Lv.50 | Pwr.150 | CD.55s)
72,Bushi,"Its body becomes a blade upon death, to be taken up by the next generation. If someone other than a Bushi wields this blade, the soul within
torments them until they are driven mad.",False,False,Fire,,"{'drop_rate': 100, 'min_drop': 1, 'max_drop': 2, 'item_name': 'Bone'}","{'drop_rate': 100, 'min_drop': 2, 'max_drop': 3, 'item_name': 'CopperIngot'}",Brandish Blade,"When activated, attacks targeted enemy with a powerful Iaigiri.","Emit Flame(Lv.2), Handcraft(Lv.1), Collection(Lv.1), Deforest(Lv.3), Transport(Lv.2)",80,100,125,80,100,100,160,600,900,4,7,4520,50,640,Ignis Blast (Lv.1 | Pwr.30 | CD.2s) | Wind Cutter (Lv.7 | Pwr.30 | CD.2s) | Icicle Cutter (Lv.15 | Pwr.55 | CD.10s) | Iaigiri (Lv.22 | Pwr.65 | CD.9s) | Ignis Breath (Lv.30 | Pwr.70 | CD.15s) | Lightning Strike (Lv.40 | Pwr.120 | CD.40s) | Ignis Rage (Lv.50 | Pwr.120 | CD.40s)
73,Beakon,"Some think it is a related species to Ragnahawk, but there is in fact no connection. Using its sharp beak, it descends on its prey in a quick motion
that resembles a bolt of lightning.",False,False,Electric,,"{'drop_rate': 100, 'min_drop': 1, 'max_drop': 2, 'item_name': 'ElectricOrgan'}",,Thunderous,Can be ridden as an flying mount. Applies Electric damage to the player's attacks while mounted.,"Generate Electricity(Lv.2), Collection(Lv.1), Transport(Lv.3)",105,100,115,80,100,160,200,750,1200,7,6,7490,50,220,Air Cannon (Lv.1 | Pwr.25 | CD.2s) | Spark Blast (Lv.7 | Pwr.30 | CD.2s) | Shockwave (Lv.15 | Pwr.40 | CD.4s) | Lightning Streak (Lv.22 | Pwr.75 | CD.16s) | Tri-Lightning (Lv.30 | Pwr.90 | CD.22s) | Sand Tornado (Lv.40 | Pwr.80 | CD.18s) | Lightning Bolt (Lv.50 | Pwr.150 | CD.55s)
74,Ragnahawk,"Some think it is a related species to Beakon, but there is in fact no connection. It mainly eats rocks, and after many long years its
beak and head have hardened to accommodate this diet.",False,False,Fire,,"{'drop_rate': 100, 'min_drop': 5, 'max_drop': 7, 'item_name': 'FireOrgan'}",,Flame Wing,Can be ridden as an flying mount. Applies Fire damage to the player's attacks while mounted.,"Emit Flame(Lv.3), Transport(Lv.3)",95,100,105,120,100,150,200,800,1300,7,7,6720,50,380,Air Cannon (Lv.1 | Pwr.25 | CD.2s) | Spirit Fire (Lv.7 | Pwr.45 | CD.7s) | Flare Arrow (Lv.15 | Pwr.55 | CD.10s) | Sand Tornado (Lv.22 | Pwr.80 | CD.18s) | Flare Storm (Lv.30 | Pwr.80 | CD.18s) | Ignis Breath (Lv.40 | Pwr.70 | CD.15s) | Fire Ball (Lv.50 | Pwr.150 | CD.55s)
75,Katress,"With the power of shadows, it produces arcane phenomena. It prefers to eat food raw and is particularly hostile towards Wixen.",False,False,Dark,,"{'drop_rate': 100, 'min_drop': 1, 'max_drop': 2, 'item_name': 'Leather'}","{'drop_rate': 50, 'min_drop': 1, 'max_drop': 1, 'item_name': 'PalItem_CatMage'}",Grimoire Collector,"While fighting together, Neutral Pals drop more items when defeated.","Handcraft(Lv.2), Product Medicine(Lv.2), Transport(Lv.2)",90,100,105,90,100,100,145,440,620,5,6,4120,50,700,Ignis Blast (Lv.1 | Pwr.30 | CD.2s) | Dark Ball (Lv.7 | Pwr.40 | CD.4s) | Flare Arrow (Lv.15 | Pwr.55 | CD.10s) | Shadow Burst (Lv.22 | Pwr.55 | CD.10s) | Spirit Flame (Lv.30 | Pwr.75 | CD.16s) | Nightmare Ball (Lv.40 | Pwr.100 | CD.30s) | Dark Laser (Lv.50 | Pwr.150 | CD.55s)
76,Wixen,"With the power of light, it produces arcane phenomena. It prefers to eat food well-done and is particularly hostile towards Katress.",False,False,Fire,,"{'drop_rate': 100, 'min_drop': 1, 'max_drop': 2, 'item_name': 'FireOrgan'}","{'drop_rate': 1, 'min_drop': 1, 'max_drop': 1, 'item_name': 'TechnologyBook_G1'}",Lord Fox,"When fighting together, applies Fire damage to the player's attacks.","Emit Flame(Lv.2), Handcraft(Lv.3), Transport(Lv.2)",90,50,110,80,120,100,145,440,620,5,6,1540,50,1160,Ignis Blast (Lv.1 | Pwr.30 | CD.2s) | Spirit Fire (Lv.7 | Pwr.45 | CD.7s) | Flare Arrow (Lv.15 | Pwr.55 | CD.10s) | Spirit Flame (Lv.22 | Pwr.75 | CD.16s) | Flare Storm (Lv.30 | Pwr.80 | CD.18s) | Fire Ball (Lv.40 | Pwr.150 | CD.55s) | Dragon Meteor (Lv.50 | Pwr.150 | CD.55s)
77,Verdash,"Land that Verdash has run across becomes extremely fertile, with thick vegetation growing there soon after.
It will not run anywhere that herbicide has been used.",False,False,Grass,,"{'drop_rate': 100, 'min_drop': 1, 'max_drop': 2, 'item_name': 'Leather'}","{'drop_rate': 100, 'min_drop': 1, 'max_drop': 1, 'item_name': 'Bone'}",Grassland Speedster,"When fighting together, increases player's movement speed and applies Grass damage to the player's attacks.","Seeding(Lv.2), Handcraft(Lv.3), Collection(Lv.3), Deforest(Lv.2), Transport(Lv.2)",90,100,115,90,100,100,195,500,700,3,8,2200,50,990,Wind Cutter (Lv.1 | Pwr.30 | CD.2s) | Stone Cannon (Lv.7 | Pwr.70 | CD.15s) | Seed Machine Gun (Lv.15 | Pwr.50 | CD.9s) | Stone Blast (Lv.22 | Pwr.55 | CD.10s) | Grass Tornado (Lv.30 | Pwr.80 | CD.18s) | Spine Vine (Lv.40 | Pwr.95 | CD.25s) | Solar Blast (Lv.50 | Pwr.150 | CD.55s)
78,Vaelet,"The castle was filled with the king's favorite flowers. A great battle ensued, and flames approached the castle.
Amidst the chaos, the spirit of a flower appeared.
 - From the fairy tale, |The King's Flower.|",False,False,Grass,,"{'drop_rate': 100, 'min_drop': 2, 'max_drop': 2, 'item_name': 'Herbs'}","{'drop_rate': 50, 'min_drop': 1, 'max_drop': 1, 'item_name': 'TomatoSeeds'}",Purification of Gaia,"While fighting together, Ground Pals drop more items when defeated.","Seeding(Lv.2), Handcraft(Lv.2), Collection(Lv.2), Product Medicine(Lv.3), Transport(Lv.1)",100,100,100,120,100,100,150,400,550,3,8,1960,50,1050,Poison Fog (Lv.1 | Pwr.0 | CD.30s) | Wind Cutter (Lv.7 | Pwr.30 | CD.2s) | Poison Blast (Lv.15 | Pwr.30 | CD.2s) | Seed Mine (Lv.22 | Pwr.65 | CD.13s) | Grass Tornado (Lv.30 | Pwr.80 | CD.18s) | Nightmare Ball (Lv.40 | Pwr.100 | CD.30s) | Solar Blast (Lv.50 | Pwr.150 | CD.55s)
79,Sibelyx,"A Pal that likes the rain, and will often bask in rain showers until the weather clears up.
On rainy days, Foxparks can often be found taking shelter beneath it.",False,False,Ice,,"{'drop_rate': 100, 'min_drop': 1, 'max_drop': 1, 'item_name': 'Cloth2'}","{'drop_rate': 100, 'min_drop': 2, 'max_drop': 3, 'item_name': 'IceOrgan'}",Silk Maker,"When activated, attacks targeted enemy with a powerful Blizzard Spike.
Sometimes produces High Quality Cloth
when assigned to Ranch.","Product Medicine(Lv.2), Cool(Lv.2), Monster Farm(Lv.1)",110,90,90,100,90,100,100,400,550,5,7,5900,50,450,Ice Missile (Lv.1 | Pwr.30 | CD.3s) | Icicle Cutter (Lv.7 | Pwr.55 | CD.10s) | Iceberg (Lv.15 | Pwr.70 | CD.15s) | Cryst Breath (Lv.22 | Pwr.90 | CD.22s) | Spirit Flame (Lv.30 | Pwr.75 | CD.16s) | Aqua Burst (Lv.40 | Pwr.100 | CD.30s) | Blizzard Spike (Lv.50 | Pwr.130 | CD.45s)
